<?xml version="1.0"?>
<restricciones xmlns:xsi="http://www.w3.org/2001/XMLSchema-instance" xsi:noNamespaceSchemaLocation="restricciones.xsd">
    <persona>
        <apellidos />
        <nombre />
    </persona>
    <empresa>
        <empleado>Juan Perez</empleado>
    </empresa>
    <edadSinrestriccion>700</edadSinrestriccion>
    <edad>18</edad>
</restricciones>